{
  "schema_version": "0.1.0",
  "dataset_version": "alzheimers-source-checked-0.7.0",
  "created_at": "2026-10-24",
  "release_status": "development",
  "scope": {
    "disease": "Alzheimer's disease",
    "inclusion_criteria": "Selected Alzheimer's association studies, human gene–protein identities, curated cholesterol-regulation and DAP12 records, binding assays from three publications, and one source-checked study-context comparison. Adds MARCO and SCARA5 from a validated public AD pathway result, APOB ligand context, curated scavenger-receptor participation and two assay-scoped modified-apoB findings from Cheng 2021.",
    "limitations": [
      "Source-checked draft: inspected locations include study abstracts/metadata, original figure captions, selected search-indexed methods/results passages, and specific database annotations; this is not a comprehensive literature or full-paper review.",
      "The four human genetic association findings retain their original variant and population scopes. Database pathways do not establish AD causality, individual risk or treatment benefit.",
      "The APOE–TREM2 binding findings concern in vitro protein constructs. They are not human clinical observations or evidence of signaling, disease causation or treatment benefit.",
      "Protein nodes represent canonical human gene products. Compartments and modified states remain in evidence context; the graph does not depict every isoform, complex or molecular state.",
      "Reactome assertions are attributed curated records, not independent experiments. Access dates are recorded; the exact Reactome database release was not captured.",
      "Independent scientific review is a future milestone. Remaining reuse and correction/retraction checks are recorded per source; no human-review attestation is inferred.",
      "One draft study-context comparison records different R47H assay reports. It does not establish a settled contradiction, the cause of the difference, or clinical effects. No research hypotheses are included.",
      "Different publication identifiers do not establish independent replication. Assay preparations, surface presentation and replicate units remain source-specific; a recorded correction does not mean a comprehensive notice search is complete.",
      "MARCO/SCARA5 inclusion was prioritized using a public AD differential-expression table. Those input statistics are not graph claims; the Cheng protein assays were not an AD patient or brain experiment, and mouse-inferred Reactome annotations retain their inference scope."
    ]
  },
  "upstream_releases": [
    {
      "provider": "NCBI Gene",
      "release": null,
      "accessed_at": "2026-10-20",
      "source_url": "https://www.ncbi.nlm.nih.gov/gene/",
      "reuse_terms_url": "https://www.ncbi.nlm.nih.gov/home/about/policies/",
      "attribution": "Gene identity metadata: National Center for Biotechnology Information, National Library of Medicine."
    },
    {
      "provider": "NLM MeSH",
      "release": null,
      "accessed_at": "2026-10-20",
      "source_url": "https://id.nlm.nih.gov/mesh/D000544.html",
      "reuse_terms_url": "https://www.ncbi.nlm.nih.gov/home/about/policies/",
      "attribution": "Disease identifier: Medical Subject Headings, National Library of Medicine."
    },
    {
      "provider": "PubMed and original publishers",
      "release": null,
      "accessed_at": "2026-10-20",
      "source_url": "https://pubmed.ncbi.nlm.nih.gov/",
      "reuse_terms_url": "https://www.ncbi.nlm.nih.gov/home/about/policies/",
      "attribution": "Publication metadata: PubMed, National Library of Medicine; findings attributed to the cited study authors. No article text is redistributed."
    },
    {
      "provider": "Reactome",
      "release": null,
      "accessed_at": "2026-10-22",
      "source_url": "https://reactome.org/content/detail/R-HSA-9029569",
      "reuse_terms_url": "https://reactome.org/license",
      "attribution": "Reactome Pathway Database, CC0 data. Specific records/locators and access dates are retained; exact database release is unresolved. No artwork copied."
    },
    {
      "provider": "UniProt",
      "release": "Individual entries updated 2026-09-02: P02649 v280, Q9NZC2 v187, O43914 v196, P19793 v263",
      "accessed_at": "2026-10-22",
      "source_url": "https://rest.uniprot.org/uniprotkb/P02649.txt",
      "reuse_terms_url": "https://rest.uniprot.org/help/license",
      "attribution": "The UniProt Consortium, UniProtKB, CC BY 4.0 (https://creativecommons.org/licenses/by/4.0/). Project-authored summaries; no sequence/source prose retained."
    },
    {
      "provider": "HGNC (pinned mirror)",
      "release": "gene-tidy commit 37b375b4e4f70445cbb9e40b273a510467b798ae; raw gzip SHA-256 6bb2951c56204cd7b387c4e40b8d46107f6bdc422e77b8e4f2088a5d39e1be4b; original HGNC release/date not independently verified",
      "accessed_at": "2026-10-24",
      "source_url": "https://raw.githubusercontent.com/MargoSolo/gene-tidy/37b375b4e4f70445cbb9e40b273a510467b798ae/src/gene_tidy/data/hgnc_complete_set.tsv.gz",
      "reuse_terms_url": "https://www.genenames.org/about/",
      "attribution": "HGNC, HUGO Gene Nomenclature Committee at the University of Cambridge, RRID:SCR_002827. Approved identity cross-references only."
    },
    {
      "provider": "Reactome (pinned human GMT mirror)",
      "release": null,
      "accessed_at": "2026-10-24",
      "source_url": "https://raw.githubusercontent.com/epigen/MrBiomics/fbe2f70935496c73ed21337af70e97e633c2f4d3/resources/ReactomePathways.gmt",
      "reuse_terms_url": "https://reactome.org/license",
      "attribution": "Reactome annotation data, mirrored by Computational Epigenetics / MrBiomics; exact upstream release unknown."
    }
  ],
  "entities": [
    {
      "id": "disease-alzheimers",
      "type": "disease",
      "label": "Alzheimer's disease",
      "aliases": [
        "Alzheimer disease",
        "Alzheimers",
        "Alzheimer's",
        "Alzheimer’s disease",
        "AD"
      ],
      "external_ids": [
        {
          "namespace": "MeSH",
          "value": "D000544"
        }
      ],
      "description": "Alzheimer Disease · MeSH D000544",
      "description_claim_ids": [],
      "provenance_source_ids": [
        "source-mesh-alzheimers"
      ]
    },
    {
      "id": "gene-apoe",
      "type": "gene",
      "label": "APOE",
      "aliases": [
        "apolipoprotein E"
      ],
      "external_ids": [
        {
          "namespace": "NCBIGene",
          "value": "348"
        }
      ],
      "description": "apolipoprotein E · human gene",
      "description_claim_ids": [],
      "provenance_source_ids": [
        "source-ncbi-apoe"
      ]
    },
    {
      "id": "gene-abca1",
      "type": "gene",
      "label": "ABCA1",
      "aliases": [
        "ATP binding cassette subfamily A member 1"
      ],
      "external_ids": [
        {
          "namespace": "NCBIGene",
          "value": "19"
        }
      ],
      "description": "ATP binding cassette subfamily A member 1 · human gene",
      "description_claim_ids": [],
      "provenance_source_ids": [
        "source-ncbi-abca1"
      ]
    },
    {
      "id": "gene-trem2",
      "type": "gene",
      "label": "TREM2",
      "aliases": [
        "triggering receptor expressed on myeloid cells 2"
      ],
      "external_ids": [
        {
          "namespace": "NCBIGene",
          "value": "54209"
        }
      ],
      "description": "triggering receptor expressed on myeloid cells 2 · human gene",
      "description_claim_ids": [],
      "provenance_source_ids": [
        "source-ncbi-trem2"
      ]
    },
    {
      "id": "paper-corder-1993",
      "type": "paper",
      "label": "Corder et al. · 1993",
      "aliases": [
        "8346443",
        "APOE epsilon4 study"
      ],
      "external_ids": [],
      "description_claim_ids": [],
      "source_id": "source-corder-1993",
      "provenance_source_ids": [
        "source-corder-1993"
      ]
    },
    {
      "id": "paper-corder-1994",
      "type": "paper",
      "label": "Corder et al. · 1994",
      "aliases": [
        "7920638",
        "APOE epsilon2 study"
      ],
      "external_ids": [],
      "description_claim_ids": [],
      "source_id": "source-corder-1994",
      "provenance_source_ids": [
        "source-corder-1994"
      ]
    },
    {
      "id": "paper-nordestgaard-2015",
      "type": "paper",
      "label": "Nordestgaard et al. · 2015",
      "aliases": [
        "26079414",
        "ABCA1 N1800H study"
      ],
      "external_ids": [],
      "description_claim_ids": [],
      "source_id": "source-nordestgaard-2015",
      "provenance_source_ids": [
        "source-nordestgaard-2015"
      ]
    },
    {
      "id": "paper-jonsson-2013",
      "type": "paper",
      "label": "Jonsson et al. · 2013",
      "aliases": [
        "23150908",
        "TREM2 R47H study"
      ],
      "external_ids": [],
      "description_claim_ids": [],
      "source_id": "source-jonsson-2013",
      "provenance_source_ids": [
        "source-jonsson-2013"
      ]
    },
    {
      "id": "protein-apoe",
      "type": "protein",
      "label": "APOE protein",
      "aliases": [
        "Apolipoprotein E",
        "P02649",
        "APOE gene product"
      ],
      "external_ids": [
        {
          "namespace": "UniProt",
          "value": "P02649"
        }
      ],
      "description": "Human protein · UniProt P02649",
      "description_claim_ids": [
        "claim-apoe-encodes"
      ],
      "provenance_source_ids": [
        "source-uniprot-apoe"
      ]
    },
    {
      "id": "protein-abca1",
      "type": "protein",
      "label": "ABCA1 protein",
      "aliases": [
        "Phospholipid-transporting ATPase ABCA1",
        "O95477",
        "ABCA1 gene product"
      ],
      "external_ids": [
        {
          "namespace": "UniProt",
          "value": "O95477"
        }
      ],